{
  "$schema": "http://json-schema.org/draft-07/schema#",
  "$id": "https://bodyforge.example.org/schema/vhforges.schema.json",
  "title": "BodyForge character proportions",
  "description": "Format of the <char>.vhforges.json file applied at runtime by the BodyForge BepInEx plugin. Schema 1 contains bone scales; schema 2 also supports neutral-based anatomical sliders.",
  "type": "object",
  "required": ["schemaVersion", "bones"],
  "additionalProperties": false,
  "properties": {
    "schemaVersion": {
      "enum": [1, 2],
      "description": "Schema 1 remains readable. Schema 2 adds the optional anatomy object."
    },
    "character": {
      "type": "string",
      "minLength": 1,
      "maxLength": 128,
      "description": "Character base name (e.g. 'lst'). Informational only; the plugin associates the file by the .fch base name itself."
    },
    "bones": {
      "type": "object",
      "additionalProperties": false,
      "patternProperties": {
        "^[A-Za-z0-9_\\-+., ]{1,64}$": {
          "type": "object",
          "required": ["scale"],
          "additionalProperties": false,
          "properties": {
            "scale": {
              "type": "array",
              "items": { "type": "number", "minimum": 0.01, "maximum": 100 },
              "minItems": 3,
              "maxItems": 3
            },
            "enabled": {
              "type": "boolean",
              "default": true,
              "description": "false ignores the bone (keeps the original localScale)."
            }
          }
        }
      },
      "description": "Map of bone name -> local transform (final scale applied to Transform.localScale). Bones not listed are left untouched."
    },
    "anatomy": {
      "type": "object",
      "default": {},
      "patternProperties": {
        "^[A-Za-z][A-Za-z0-9_-]{0,63}$": {
          "type": "number",
          "minimum": -1,
          "maximum": 1
        }
      },
      "additionalProperties": false,
      "description": "Semantic anatomical slider values. Zero is always the exact vanilla body. The active model profile maps values to its own anatomy; equipment uses the resulting shared deformation field."
    },
    "editorState": {
      "type": "object",
      "default": {},
      "additionalProperties": false,
      "properties": {
        "showBoneControls": {
          "type": "boolean",
          "default": false,
          "description": "Whether the editor displays the optional advanced bone controls. This does not affect the applied bone values."
        }
      },
      "description": "Optional editor-only presentation state ignored by the runtime plugin."
    }
  }
}
